<?xml version="1.0" encoding="UTF-8"?>
<?xml-stylesheet type="text/xsl" href="hw6.xsl"?>

<Members xmlns:xsi="http://www.w3.org/2001/XMLSchema-instance" xsi:noNamespaceSchemaLocation="https://github.com/Dior-M/Dior-M.github.io/blob/main/Root_folder/hw6.xsd">
  <Member>
    <Name>Jonathan Mark</Name>
    <Age>22</Age>
    <Job>Consultant</Job>
    <Date>2016-05-20</Date>
    <Phone>415-343-2277</Phone>
  </Member>
  
  <!-- Testing records here -->
  
  <Member>
    <Name>Alice Johnson</Name>
    <Age>33</Age>
    <Job>Engineer</Job>
    <Date>2017-08-15</Date>
    <Phone>123-456-7890</Phone>
  </Member>
  
  <Member>
    <Name>Bob Smith</Name>
    <Age>45</Age>
    <Job>Designer</Job>
    <Date>2020-01-10</Date>
    <Phone>987-654-3210</Phone>
  </Member>
</Members>

